Question,Answer
我如果想要引用健康九九網站上的教材或是文章資訊可以嗎？,您好：目前放置於九九健康網上的相關教材，僅提供民眾個人下載觀賞，而本網站之教材及文章資訊，除國民健康署提供外，尚匯集了許多衛生福利部下相關單位資訊(如衛生福利部疾病管制署、衛生福利部食品藥物管理署、衛生福利部中央健康保險署等)，建議您使用網址連結較不易產生版權問題，如需將整個檔案下載後放置於您的網站上，建請您條列所需教材後，去函至相關單位洽詢授權乙事。
我想要修改e-mail帳號，卻無法於會員中心修改，要如何處理？,您好，本網站已於97年8月11日修改會員帳號系統，全面使用您所登記的”e-mail”做為會員帳號，如需修改e-mail帳號，可於聯絡我們http://health99.hpa.gov.tw/Contactus.aspx，提供您原e-mail帳號及新e-mail帳號及所提記的姓名或電話供服務人員查證修改，或直接來電0800-070-088、(02)2351-9047，將由專人為您處理。
我已加入會員，但卻一直未收到會員認證信，該如何處理？,"您好，可至本網站會員中心補發認證信http://health99.hpa.gov.tw/ReSendConfirm.aspx，鍵入登記之姓名及e-mail後即會補發，如出現「您輸入資料不在會員中,請重新輸入」，表示您於申請時姓名或是e-mail鍵入錯誤，請來電網站服務電話0800-070-088、(02)2351-9047，將由專人為您處理。"
教材或海報自行下載印製有版權問題嗎？,您好：由於本網站教材僅提供民眾個人瀏覽、下載，並不提供版權予個人或單位大量印製，如需印製請洽原製作單位洽詢版權問題，謝謝！
密碼忘了怎麼辦,您好：若要查詢您的密碼，請至本網站會員中心 http://health99.hap.gov.tw/MemberZone/ChangePwd.aspx 「忘記密碼」頁面，輸入您的「會員帳號」、「電子郵件」後，系統會自動將會員資料寄送到您的電子信箱。若忘記您的資料，請重新加入本網站會員，謝謝！
請問哪裡會有性教育的單張呢？因為現在的醫院都拿不到耶,可至各衛生局所索取，亦可電洽(04)2255-0177國民健康署-婦幼健康組
